{
  "schema_version": 1,
  "timer_id": "timer:calendar-event-123:departure-due",
  "purpose": "schedule.departure_due",
  "due_at": "2026-09-08T10:30:00-07:00",
  "status": "pending",
  "subject_ids": ["person:april", "calendar-event:123"],
  "caused_by": ["3f2504e0-4f89-41d3-9a0c-0305e82c3301"],
  "payload": { "calendar_event_id": "calendar-event:123" }
}
